<?xml version="1.0" encoding="utf-8"?>
<!DOCTYPE resources SYSTEM "../map.dtd" []>
<resources>
  <author>
    <name>Lawrence AZZOUG</name>
    <nickname>Lami</nickname>
    <email>lawrenceazzoug AT wanadoo.fr</email>
    <country>France</country>
  </author>

  <surface name="sky" file="noir_lune.jpg" />
  <surface name="map" file="halloween.png" />
  <surface name="preview" file="preview.jpg" />

  <name>Halloween</name>
  <water>0</water>
  <nb_mine>3</nb_mine>
  <is_open>1</is_open>

    <sprite name="wind_particle">
      <image file="confetis.png">
        <grid pos="15,0" size="48,36" array="48,1"/>
      </image>
      <animation speed="100" />
    </sprite>

  <wind>
    <nbr_sprite>10</nbr_sprite>
    <mass>4.3</mass>
    <wind_factor>2.3</wind_factor>
    <air_resist_factor>0.1</air_resist_factor>
    <gravity_factor>0.1</gravity_factor>
    <rebounding>false</rebounding>
    <rebound_factor>1.3</rebound_factor>
  </wind>

</resources>
