<?xml version="1.0" encoding="utf-8"?>
<!DOCTYPE resources SYSTEM "../map.dtd" []>
<resources>
	<author>
		<name>Benjamin Cluck</name>
		<nickname>Batmanifestdestiny</nickname>
		<email>I'm not gonna tell you</email>
		<country>America</country>
	</author>

	<surface name="sky" file="sky.jpg" />
	<surface name="map" file="background.png" />
	<surface name="preview" file="preview.jpg" />


	<name>The Shire</name>
	<water>no</water>
	<nb_mine>10</nb_mine>
	<is_open>0</is_open>

</resources>
