<?xml version="1.0" encoding="utf-8"?>
<!DOCTYPE resources SYSTEM "../map.dtd" []>
<resources>
  <author>
    <name>C. Schalkwijk</name>
    <nickname>Papa.Coen</nickname>
    <email>Papa.Coen@gmail.com</email>
    <country>The Netherlands</country>
  </author>

  <surface name="sky" file="sky.jpg" />
  <surface name="map" file="crystal.png" />
  <surface name="preview" file="preview.jpg" />

  <name>Crystal</name>
  <water>3</water>
  <nb_mine>3</nb_mine>
  <is_open>1</is_open>
  <!-- pad is given in pixel count. -->
  <add_pad>1</add_pad>
  <point name="upper_left_pad" x="1200" y="700" />
  <point name="lower_right_pad" x="1200" y="0" />
</resources>
