<?xml version="1.0" encoding="utf-8"?>
<!DOCTYPE resources SYSTEM "../map.dtd" []>
<resources>
	<author>
		<name>Tomasz Majbaum</name>
		<nickname>Ahriman</nickname>
		<email>anunnaki AT o2.pl</email>
		<country>Poland</country>
	</author>

  <surface name="sky" file="backgr.jpg" />
  <surface name="map" file="wildwestdv.png" />
  <surface name="preview" file="preview.jpg" />

  <name>Wild West - Death Valley</name>
  <water>0</water>
  <nb_mine>3</nb_mine>
  <is_open>1</is_open>
</resources>
