<?xml version="1.0" encoding="utf-8"?>
<!DOCTYPE resources SYSTEM "../map.dtd" []>
<resources>
 
 <author>
   <name>Maciej Mrozi≈Ñski</name>
   <nickname>alzen</nickname>
   <email>mynick2_at_o2_dot_pl</email>
   <country>Poland</country>
 </author>

 <surface name="sky" file="background.jpg" />
 <surface name="map" file="map.png" />
 <surface name="preview" file="preview.jpg" />
 
 <name>Arcade Room</name>
  <water>water</water>
 <nb_mine>6</nb_mine>
 <is_open>1</is_open>
 
 <sprite name="wind_particle">
   <image file="wind_particle.png">
     <grid pos="0,0" size="59,59" array="124,1"/>
   </image>
 </sprite>
 
 <wind>
   <nbr_sprite>40</nbr_sprite>
   <need_flip>0</need_flip>
   <rotation_speed>0.00</rotation_speed>
   <mass>2.0</mass>
   <wind_factor>6.5</wind_factor>
   <air_resist_factor>0.1</air_resist_factor>
   <gravity_factor>0.2</gravity_factor>
   <rebounding>true</rebounding>
   <rebound_factor>3.3</rebound_factor>
 </wind>
 
 <music_playlist>funfair</music_playlist>
 
</resources>
