<?xml version="1.0" encoding="UTF-8"?>
<!DOCTYPE resources SYSTEM "../map.dtd" []>
<resources>
  <author>
    <name>Lawrence AZZOUG</name>
    <nickname>Lami</nickname>
    <email>lawrenceazzoug AT wanadoo.fr</email>
    <country>France</country>
  </author>

  <surface name="sky" file="sky.jpg" />
  <surface name="map" file="map.png" />
  <surface name="preview" file="preview.jpg" />

  <name>Space 2</name>
  <water>0</water>
  <nb_mine>3</nb_mine>
  <is_open>0</is_open>
</resources>
